{"assumptions":{"score_delta_from_selected":"row_score_minus_selected_score","selection":"best_ranked_timeline_is_selected","source":"campaign_plan.ranked_timelines"},"model":"ranked_timeline_score_term_tradeoffs","model_limits":["deterministic_score_explainability_only","score_policy_supplied_by_request","no_solver_execution","not_calibrated_from_operational_outcomes"],"objective":"maximize weighted observation value and contact value","policy":{"activity_count_penalty":0,"contact_value_weight":0.2,"eclipse_penalty_weight":1,"rank_limit":5,"target_value_weight":1},"ranking_count":1,"schema_contract":"objective_tradeoff_report.v1","score_term_keys":["activity_count_penalty","activity_score","contact_value","eclipse_penalty","selected_contact_count","selected_observation_count","target_value"],"tradeoffs":[{"activity_count":1,"activity_ids":["leo_1_observe_target_a_1"],"rank":1,"scenario_id":"leo_1","score":1417.2731832107565,"score_delta_from_selected":0,"score_terms":{"activity_count_penalty":0,"activity_score":1417.2731832107565,"contact_value":0,"eclipse_penalty":0,"selected_contact_count":0,"selected_observation_count":1,"target_value":1417.2731832107565},"selected_contact_count":0,"selected_observation_count":1}]}
